Task ID,Title,Type,Priority,Category,Size,Sprint,Estimated Hours,Dependencies,Description
TASK-001,Install and Configure PostgreSQL,chore,P0-Critical,infrastructure,S,Sprint-1,1.5,None,Install PostgreSQL 15 create database and user verify connectivity
TASK-002,Install and Configure Redis,chore,P0-Critical,infrastructure,S,Sprint-1,0.5,None,Install Redis for caching and session management verify connectivity
TASK-003,Initialize API Project Structure,chore,P0-Critical,backend,M,Sprint-1,2.5,TASK-001 TASK-002,Set up Fastify API project with TypeScript proper folder structure and configuration files
TASK-004,Install Backend Dependencies,chore,P0-Critical,backend,S,Sprint-1,1,TASK-003,Install all required npm packages for the backend API
TASK-005,Configure Prisma and Database Schema,chore,P0-Critical,backend,L,Sprint-1,5,TASK-003 TASK-004,Initialize Prisma ORM define complete database schema run initial migration
TASK-006,Create Fastify Server Setup,feature,P0-Critical,backend,M,Sprint-1,3.5,TASK-004,Create main server file with Fastify initialization middleware and basic configuration
TASK-007,Create Configuration Management,chore,P0-Critical,backend,S,Sprint-1,2,TASK-006,Create centralized configuration module for environment variables with validation
TASK-008,Set Up Logging System,chore,P1-High,backend,S,Sprint-1,2,TASK-006,Configure Winston for structured logging with multiple transports
TASK-009,Create Database Connection Service,chore,P0-Critical,backend,S,Sprint-1,2,TASK-005,Create Prisma client singleton with proper connection pooling
TASK-010,Create Redis Connection Service,chore,P0-Critical,backend,S,Sprint-1,2,TASK-002,Create Redis client with connection management and helper methods
TASK-011,Set Up Testing Framework,chore,P1-High,testing,M,Sprint-1,3.5,TASK-005 TASK-009,Configure Jest for unit and integration testing with proper setup
TASK-012,Create NPM Scripts,chore,P1-High,backend,XS,Sprint-1,1,TASK-004,Add helpful npm scripts to package.json for development workflow
TASK-013,Create Database Seeding Script,chore,P2-Medium,backend,M,Sprint-1,3.5,TASK-005,Create seed script to populate database with sample data for development
TASK-014,Implement GitHub OAuth Flow,feature,P0-Critical,backend,L,Sprint-2,7,TASK-006 TASK-009,Implement complete GitHub OAuth authentication flow with JWT token generation
TASK-015,Create JWT Authentication Middleware,feature,P0-Critical,backend,M,Sprint-2,3.5,TASK-014,Create middleware to verify JWT tokens and protect routes
TASK-016,Implement User Profile Management,feature,P1-High,backend,M,Sprint-2,4,TASK-015,Create user profile viewing and updating functionality
TASK-017,Implement Repository Listing from GitHub,feature,P0-Critical,backend,M,Sprint-2,4,TASK-015,Fetch and display user's GitHub repositories using Octokit
TASK-018,Implement Repository Connection,feature,P0-Critical,backend,L,Sprint-2,7,TASK-017,Allow users to connect repositories and register webhooks
TASK-019,Implement Historical Data Import,feature,P1-High,backend,XL,Sprint-2,10,TASK-018,Import last 90 days of repository data on connection
TASK-020,Create Webhook Endpoint,feature,P0-Critical,backend,M,Sprint-2,4,TASK-010,Create endpoint to receive GitHub webhooks with signature validation
TASK-021,Implement Webhook Queue Processing,feature,P0-Critical,backend,L,Sprint-2,7,TASK-020,Process webhook events asynchronously using Bull queue
TASK-022,Implement Event Processors,feature,P0-Critical,backend,L,Sprint-2,9,TASK-021,Create processors for different GitHub event types (push PR issues)
TASK-023,Implement Basic Metrics Service,feature,P0-Critical,backend,L,Sprint-2,9,TASK-022,Create service to calculate developer and team metrics from event data
TASK-024,Create Metrics API Endpoints,feature,P0-Critical,backend,M,Sprint-2,4.5,TASK-023,Create API endpoints to retrieve metrics with filtering and pagination
TASK-025,Implement Metrics Aggregation Jobs,chore,P1-High,backend,M,Sprint-2,4,TASK-023,Create scheduled jobs to aggregate metrics daily
TASK-026,Initialize Frontend Project,chore,P0-Critical,frontend,M,Sprint-3,3.5,None,Set up Next.js 14 frontend with TypeScript and Tailwind CSS
TASK-027,Create API Client Library,chore,P0-Critical,frontend,M,Sprint-3,3.5,TASK-026,Create TypeScript API client for communicating with backend
TASK-028,Implement Authentication Flow (Frontend),feature,P0-Critical,frontend,L,Sprint-3,7,TASK-027 TASK-014,Build frontend authentication flow with GitHub OAuth
TASK-029,Create Layout and Navigation,feature,P1-High,frontend,M,Sprint-3,4.5,TASK-028,Build main application layout with sidebar navigation
TASK-030,Create Main Dashboard Page,feature,P0-Critical,frontend,L,Sprint-3,9,TASK-029 TASK-024,Build dashboard with overview cards charts and activity feed
TASK-031,Implement Metrics Charts,feature,P1-High,frontend,L,Sprint-3,7,TASK-030,Create reusable chart components using Recharts
TASK-032,Create Repository Management Page,feature,P0-Critical,frontend,L,Sprint-3,9,TASK-029 TASK-018,Build UI to view and manage connected repositories
TASK-033,Create Individual Developer Metrics Page,feature,P1-High,frontend,M,Sprint-3,5.5,TASK-030 TASK-024,Display personal contribution metrics with team comparison
TASK-034,Implement WebSocket Server (Backend),feature,P1-High,backend,M,Sprint-3,4,TASK-006,Set up Socket.io server for real-time updates
TASK-035,Emit Real-time Events from Backend,feature,P1-High,backend,M,Sprint-3,3.5,TASK-034 TASK-022,Emit Socket.io events when metrics update
TASK-036,Implement WebSocket Client (Frontend),feature,P1-High,frontend,M,Sprint-3,4,TASK-035,Connect frontend to Socket.io for real-time updates
TASK-037,Add Real-time Updates to Dashboard,feature,P1-High,frontend,S,Sprint-3,3,TASK-036 TASK-030,Make dashboard update in real-time without refresh
TASK-038,Create Settings Page,feature,P2-Medium,frontend,M,Sprint-3,5.5,TASK-029,Build settings page for user preferences and configuration
TASK-039,Implement Claude API Client,chore,P0-Critical,ai,S,Sprint-4,2.5,None,Create service wrapper for Anthropic Claude API
TASK-040,Implement AI Code Review for PRs,feature,P0-Critical,ai,XL,Sprint-4,11,TASK-039 TASK-022,Automatically analyze PRs using Claude AI
TASK-041,Display AI Insights in Frontend,feature,P1-High,frontend,M,Sprint-4,4.5,TASK-040 TASK-030,Show AI-generated insights about PRs and code quality
TASK-042,Implement Predictive Analytics,feature,P2-Medium,ai,L,Sprint-4,9,TASK-039 TASK-023,Build sprint completion prediction and burnout detection
TASK-043,Create Notification System,feature,P1-High,backend,L,Sprint-4,7,TASK-034,Build flexible notification system with multiple channels
TASK-044,Implement Slack Integration,feature,P1-High,integration,M,Sprint-4,4.5,TASK-043,Send important alerts to Slack channels
TASK-045,Create In-App Notification UI,feature,P1-High,frontend,M,Sprint-4,5.5,TASK-043 TASK-036,Display notifications within the app with real-time delivery
TASK-046,Generate OpenAPI Documentation,chore,P1-High,docs,M,Sprint-4,3.5,All API routes,Auto-generate API documentation with Swagger
TASK-047,Implement External API Access,feature,P2-Medium,backend,M,Sprint-4,4.5,TASK-046,Create API key system for external access
TASK-048,Implement Caching Strategy,chore,P1-High,backend,M,Sprint-4,4.5,TASK-010,Optimize performance with strategic Redis caching
TASK-049,Database Query Optimization,chore,P1-High,backend,M,Sprint-4,4,TASK-005,Optimize slow queries and add database indexes
TASK-050,Frontend Performance Optimization,chore,P2-Medium,frontend,M,Sprint-4,4.5,TASK-026,Optimize bundle size and rendering performance
TASK-051,Achieve 70% Test Coverage,chore,P1-High,testing,L,Sprint-4,9,TASK-011,Write comprehensive tests for 70% coverage
TASK-052,E2E Testing for Critical Flows,chore,P2-Medium,testing,M,Sprint-4,5.5,Major features,Write end-to-end tests using Playwright
TASK-053,Security Audit & Fixes,chore,P0-Critical,backend,M,Sprint-4,4.5,All features,Perform security audit and fix vulnerabilities
TASK-054,Create Docker Configuration,chore,P1-High,infrastructure,M,Sprint-4,4.5,None,Dockerize application for deployment
TASK-055,Set Up CI/CD Pipeline,chore,P1-High,infrastructure,M,Sprint-4,4.5,TASK-054,Configure GitHub Actions for automated deployment
TASK-056,Deploy to Production,chore,P0-Critical,infrastructure,L,Sprint-4,7,TASK-055,Deploy application to production cloud environment
TASK-057,Write Comprehensive README,chore,P1-High,docs,S,Sprint-4,2.5,None,Create detailed README with setup instructions
TASK-058,Create Demo Video,chore,P2-Medium,docs,S,Sprint-4,3.5,All features,Record 5-minute demo video
TASK-059,UI/UX Polish,chore,P2-Medium,frontend,M,Sprint-4,4.5,All frontend,Final polish of user interface and experience
TASK-060,Post-Mortem Documentation,chore,P2-Medium,docs,S,Sprint-4,2.5,Project complete,Document learning journey and reflections
TASK-061,Implement Advanced Visualizations,enhancement,P3-Low,frontend,XL,Backlog,17.5,TASK-031,3D graphs network graphs heatmaps and custom dashboards
TASK-062,Machine Learning Pipeline,enhancement,P3-Low,ai,XL,Backlog,25,TASK-023,Anomaly detection burnout prediction sprint completion ML
TASK-063,SSO Integration,enhancement,P3-Low,backend,L,Backlog,12.5,TASK-014,SAML LDAP Azure AD Okta integration
TASK-064,Advanced Role-Based Access Control,enhancement,P3-Low,backend,L,Backlog,9,TASK-015,Custom roles and granular permissions
TASK-065,Multi-tenant Architecture,enhancement,P3-Low,backend,XL,Backlog,17.5,All features,Data isolation and per-tenant branding
TASK-066,React Native Mobile App,enhancement,P3-Low,frontend,XL,Backlog,45,All features,iOS and Android apps with push notifications
TASK-067,Jira Integration,enhancement,P3-Low,integration,L,Backlog,11,TASK-018,Sync issues and sprints with Jira
TASK-068,Discord Integration,enhancement,P3-Low,integration,L,Backlog,7,TASK-043,Discord webhook notifications and bot
TASK-069,GitLab Support,enhancement,P3-Low,integration,XL,Backlog,17.5,TASK-014,Support GitLab in addition to GitHub

